<?xml version="1.0" encoding="UTF-8"?>
<p:nutz-mapping package="org.nutz.dao.impl.entity.xml" xmlns:p="http://nutzam.com/schema/entities" xmlns:xsi="http://www.w3.org/2001/XMLSchema-instance" xsi:schemaLocation="http://nutzam.com/schema/entities nutz-dao-0.1.xsd ">
  <entity comment="" pks="" table="t_iot_user" type="IotUser" view="">
    <id/>
    <name/>
    <field name="age"></field>
    <field column="loc" name="location">
      <coldefine auto="true" customType="" insert="true" notNull="true" precision="0" type="" unsigned="false" update="true" width="0"/>
    </field>
    <one field="level" name="level" target="IotUserLevel"/>
    <index fields="age" name="age" unique="true"/>
  </entity>
</p:nutz-mapping>
